{
  "artifact": "oph_hadron_backend_raw_export",
  "backend": {
    "build_id": "<fill-me>",
    "family": "rhmc_hmc",
    "git_commit": "<fill-me>",
    "machine": "<fill-me>",
    "name": "<fill-me>",
    "run_id": "<fill-me>",
    "version": "<fill-me>"
  },
  "boundary_conditions": {},
  "claim_tier": "unfilled_backend_export_template",
  "contractions": {},
  "ensembles": [
    {
      "cfgs": [
        {
          "cfg_id": "qcd_2p1_seed_n0__cfg0",
          "sources": [
            {
              "coord": [
                0,
                0,
                0,
                0
              ],
              "datasets": {
                "N_iso_direct": "/ensembles/qcd_2p1_seed_n0/cfgs/qcd_2p1_seed_n0__cfg0/sources/s0/N_iso_direct",
                "N_iso_exchange": "/ensembles/qcd_2p1_seed_n0/cfgs/qcd_2p1_seed_n0__cfg0/sources/s0/N_iso_exchange",
                "pi_iso": "/ensembles/qcd_2p1_seed_n0/cfgs/qcd_2p1_seed_n0__cfg0/sources/s0/pi_iso"
              },
              "src_id": "s0"
            },
            {
              "coord": [
                73,
                73,
                73,
                145
              ],
              "datasets": {
                "N_iso_direct": "/ensembles/qcd_2p1_seed_n0/cfgs/qcd_2p1_seed_n0__cfg0/sources/s1/N_iso_direct",
                "N_iso_exchange": "/ensembles/qcd_2p1_seed_n0/cfgs/qcd_2p1_seed_n0__cfg0/sources/s1/N_iso_exchange",
                "pi_iso": "/ensembles/qcd_2p1_seed_n0/cfgs/qcd_2p1_seed_n0__cfg0/sources/s1/pi_iso"
              },
              "src_id": "s1"
            }
          ],
          "trajectory_stop": 2048
        },
        {
          "cfg_id": "qcd_2p1_seed_n0__cfg1",
          "sources": [
            {
              "coord": [
                0,
                0,
                0,
                0
              ],
              "datasets": {
                "N_iso_direct": "/ensembles/qcd_2p1_seed_n0/cfgs/qcd_2p1_seed_n0__cfg1/sources/s0/N_iso_direct",
                "N_iso_exchange": "/ensembles/qcd_2p1_seed_n0/cfgs/qcd_2p1_seed_n0__cfg1/sources/s0/N_iso_exchange",
                "pi_iso": "/ensembles/qcd_2p1_seed_n0/cfgs/qcd_2p1_seed_n0__cfg1/sources/s0/pi_iso"
              },
              "src_id": "s0"
            },
            {
              "coord": [
                73,
                73,
                73,
                145
              ],
              "datasets": {
                "N_iso_direct": "/ensembles/qcd_2p1_seed_n0/cfgs/qcd_2p1_seed_n0__cfg1/sources/s1/N_iso_direct",
                "N_iso_exchange": "/ensembles/qcd_2p1_seed_n0/cfgs/qcd_2p1_seed_n0__cfg1/sources/s1/N_iso_exchange",
                "pi_iso": "/ensembles/qcd_2p1_seed_n0/cfgs/qcd_2p1_seed_n0__cfg1/sources/s1/pi_iso"
              },
              "src_id": "s1"
            }
          ],
          "trajectory_stop": 2560
        }
      ],
      "ensemble_id": "qcd_2p1_seed_n0"
    },
    {
      "cfgs": [
        {
          "cfg_id": "qcd_2p1_seed_n1__cfg0",
          "sources": [
            {
              "coord": [
                0,
                0,
                0,
                0
              ],
              "datasets": {
                "N_iso_direct": "/ensembles/qcd_2p1_seed_n1/cfgs/qcd_2p1_seed_n1__cfg0/sources/s0/N_iso_direct",
                "N_iso_exchange": "/ensembles/qcd_2p1_seed_n1/cfgs/qcd_2p1_seed_n1__cfg0/sources/s0/N_iso_exchange",
                "pi_iso": "/ensembles/qcd_2p1_seed_n1/cfgs/qcd_2p1_seed_n1__cfg0/sources/s0/pi_iso"
              },
              "src_id": "s0"
            },
            {
              "coord": [
                145,
                145,
                145,
                290
              ],
              "datasets": {
                "N_iso_direct": "/ensembles/qcd_2p1_seed_n1/cfgs/qcd_2p1_seed_n1__cfg0/sources/s1/N_iso_direct",
                "N_iso_exchange": "/ensembles/qcd_2p1_seed_n1/cfgs/qcd_2p1_seed_n1__cfg0/sources/s1/N_iso_exchange",
                "pi_iso": "/ensembles/qcd_2p1_seed_n1/cfgs/qcd_2p1_seed_n1__cfg0/sources/s1/pi_iso"
              },
              "src_id": "s1"
            }
          ],
          "trajectory_stop": 2048
        },
        {
          "cfg_id": "qcd_2p1_seed_n1__cfg1",
          "sources": [
            {
              "coord": [
                0,
                0,
                0,
                0
              ],
              "datasets": {
                "N_iso_direct": "/ensembles/qcd_2p1_seed_n1/cfgs/qcd_2p1_seed_n1__cfg1/sources/s0/N_iso_direct",
                "N_iso_exchange": "/ensembles/qcd_2p1_seed_n1/cfgs/qcd_2p1_seed_n1__cfg1/sources/s0/N_iso_exchange",
                "pi_iso": "/ensembles/qcd_2p1_seed_n1/cfgs/qcd_2p1_seed_n1__cfg1/sources/s0/pi_iso"
              },
              "src_id": "s0"
            },
            {
              "coord": [
                145,
                145,
                145,
                290
              ],
              "datasets": {
                "N_iso_direct": "/ensembles/qcd_2p1_seed_n1/cfgs/qcd_2p1_seed_n1__cfg1/sources/s1/N_iso_direct",
                "N_iso_exchange": "/ensembles/qcd_2p1_seed_n1/cfgs/qcd_2p1_seed_n1__cfg1/sources/s1/N_iso_exchange",
                "pi_iso": "/ensembles/qcd_2p1_seed_n1/cfgs/qcd_2p1_seed_n1__cfg1/sources/s1/pi_iso"
              },
              "src_id": "s1"
            }
          ],
          "trajectory_stop": 2560
        }
      ],
      "ensemble_id": "qcd_2p1_seed_n1"
    },
    {
      "cfgs": [
        {
          "cfg_id": "qcd_2p1_seed_n2__cfg0",
          "sources": [
            {
              "coord": [
                0,
                0,
                0,
                0
              ],
              "datasets": {
                "N_iso_direct": "/ensembles/qcd_2p1_seed_n2/cfgs/qcd_2p1_seed_n2__cfg0/sources/s0/N_iso_direct",
                "N_iso_exchange": "/ensembles/qcd_2p1_seed_n2/cfgs/qcd_2p1_seed_n2__cfg0/sources/s0/N_iso_exchange",
                "pi_iso": "/ensembles/qcd_2p1_seed_n2/cfgs/qcd_2p1_seed_n2__cfg0/sources/s0/pi_iso"
              },
              "src_id": "s0"
            },
            {
              "coord": [
                290,
                290,
                290,
                581
              ],
              "datasets": {
                "N_iso_direct": "/ensembles/qcd_2p1_seed_n2/cfgs/qcd_2p1_seed_n2__cfg0/sources/s1/N_iso_direct",
                "N_iso_exchange": "/ensembles/qcd_2p1_seed_n2/cfgs/qcd_2p1_seed_n2__cfg0/sources/s1/N_iso_exchange",
                "pi_iso": "/ensembles/qcd_2p1_seed_n2/cfgs/qcd_2p1_seed_n2__cfg0/sources/s1/pi_iso"
              },
              "src_id": "s1"
            }
          ],
          "trajectory_stop": 2048
        },
        {
          "cfg_id": "qcd_2p1_seed_n2__cfg1",
          "sources": [
            {
              "coord": [
                0,
                0,
                0,
                0
              ],
              "datasets": {
                "N_iso_direct": "/ensembles/qcd_2p1_seed_n2/cfgs/qcd_2p1_seed_n2__cfg1/sources/s0/N_iso_direct",
                "N_iso_exchange": "/ensembles/qcd_2p1_seed_n2/cfgs/qcd_2p1_seed_n2__cfg1/sources/s0/N_iso_exchange",
                "pi_iso": "/ensembles/qcd_2p1_seed_n2/cfgs/qcd_2p1_seed_n2__cfg1/sources/s0/pi_iso"
              },
              "src_id": "s0"
            },
            {
              "coord": [
                290,
                290,
                290,
                581
              ],
              "datasets": {
                "N_iso_direct": "/ensembles/qcd_2p1_seed_n2/cfgs/qcd_2p1_seed_n2__cfg1/sources/s1/N_iso_direct",
                "N_iso_exchange": "/ensembles/qcd_2p1_seed_n2/cfgs/qcd_2p1_seed_n2__cfg1/sources/s1/N_iso_exchange",
                "pi_iso": "/ensembles/qcd_2p1_seed_n2/cfgs/qcd_2p1_seed_n2__cfg1/sources/s1/pi_iso"
              },
              "src_id": "s1"
            }
          ],
          "trajectory_stop": 2560
        }
      ],
      "ensemble_id": "qcd_2p1_seed_n2"
    }
  ],
  "execution_class": "production_request_template",
  "files": {
    "correlators_hdf5": "correlators.h5"
  },
  "format_version": 1,
  "integrator": {},
  "physics": {
    "branch": "seeded_2p1_qed_off",
    "notes": [
      "Fill this manifest with the exact backend profile and runtime provenance before publication.",
      "Do not replace NaN datasets with synthetic values. All datasets must come from real backend execution.",
      "This generated template is fail-closed. A backend owner must explicitly replace execution_class, claim_tier, and public_promotion_allowed only after a real run and complete provenance."
    ],
    "target_channels": [
      "pi_iso",
      "N_iso"
    ]
  },
  "profile_id": "oph_reference_backend_v1",
  "public_promotion_allowed": false,
  "solvers": {},
  "sources": {}
}
